lyrics,artist,
"All washed down the drain, all washed down the drain Take it home with you I don't know what to say to you But I know how it can be Drop to the whisper, and take it while you can It's only a little bird in the palm of your big hand Racked my brain and now I'm confused as hell I don't know what you want If it's all the same, I think I'll go on home Droppin' a whisper, and take it while you can It's only a little bird in the palm of your big hand No one can change You can't change",sebadoh,
"Never did and never will It's just the way it's always been I've made mistakes before, I'll make the same again And all this tension we ignore surely works its ugly way inside I have known that nothing's fair, surely what did I expect? When magic slips into the air and every day's another test And all this tension we ignore, it surely works its ugly way outside So let it build, let it explode Leaving blood and shattered bone Or bite your tongue til you've forgotten what to say And take another step back, until you find you've walked away Silence like disease, but I dare not say it hurts Cuz if I honestly react, nothing's ever gonna work All this tension back and forth It's just the beauty of the ride It's just the beauty of the ride So let it build, let it explode Leaving blood and shattered bone Or bite your tongue til you've forgotten what to say And take another step back, until you find you've walked away",sebadoh,
"Five years wading in the pool With more rules than a Sunday school Woke up, took a shower Now I've got soul power I smell a rat I smell a rat I know I smell a rat, baby Got a ride on the midnight train To the beauty of the brain I got drunk, on love Got stuck in the mud I smell a rat I smell a rat I know I smell a rat, baby I smell a rat I smell a rat Plant the garden on the wall Paint the ceiling on the floor Sit back, relax, breathe deep I smell a rat (X8) I smell a rat, rat, rat, rat",sebadoh,
"Descended from Emerson, into this life Falling, falling, falling into my seventh life My father rode a motorcycle naked in the rain Mother, a flower girl, blonde and 18 Three long days in the Colorado jail Seven months pregnant, on the western trail She met El in San Francisco, so it goes (She met El in San Francisco, yeah so it goes) Elwyn was out of his head, speed up his nose Mother met a second man, by chance She remembered from a hometown high school dance The night they got to fighting, man's arms, they let me fall My head hit the concrete floor, I didn't move at all My mom hysterical, thinking I was dead She ran into the street, scared out of her head I watched the stars in the heavens for a while Then I came around for good, but not with a smile Moved home to the valley where the hippies conspire Even my grandma loved to get high My father dosed liquid LSD Fried his mind for years to come, look what it's done to me The breakup ensued, I held my baby brother's hand I held my baby brother's hand The nights that followed, footsteps could be heard (The nights that followed in the house, footsteps could be heard) No one on the second floor cept spirits I have learned Mom and her best friend said, ""It's time to go"" To Aroyo Hondo, New Mexico Adobe huts, I recall every gathering adobe I was hungry in the desert; I wanted to go home Morning I awoke; I was all alone (But I walked outside I realized) No one but a fucking geek to share the dusty home (No one was there; I thought I would die) As I walked outside I realized (Time stood still; I watched the dome) No one was there; I thought I would die (Then the bug came back, tears in my throat) Time stood still as I watched the goat (Next thing I knew I was in public school) The nurse of a new bug came back; tears in my throat (It wasn't much, but it followed the rules) Next thing I knew I was in public school (Sat alone; stood alone) It wasn't much, but it followed the rules (Tried my best to understand my broken home) Sat alone; stood alone (I got to watch my poor mother cry) Tried to understand my broken home (Empty, exposed to all she felt inside) I got to watch my poor mother cry (And then I hear these hippies philosophize) Empty, exposed to all she felt inside And hear these hippies philosophize And dreaming of the commune in the sky (Too many changing partners at different times Brothers and sisters, don't get too close And dreaming of the commune in the sky And mother waves him goodbye, so I'm left here on my puzzle with nobody's help) Boycott society, then the kids can't socialize (My faith is my strength, living in hell) We had a cat named ""Hope"" and soon it died (Thinking about our locks too thin, wondering if I'm at all like him) There were nervous breakdowns every day, numerous crises games (Before the flood, before the flood, of blood, I'm dead serious, you just you wait) Parents like to play, too many changing partners (The Nazi Klan looked like 6) At different times (The plan is well underway) Brothers and sisters, don't get too close (Those who crossed me are cursed, will see fewer days) Another routine goodbye (You'll listen to me; let's kill in the street) So I'm workin' on my puzzle with nobody's help (You made a big mistake so just you fuckin', livin in hell, El) My faith is my strength because I'm living in hell, thinkin' about hell, Locked in the bin, wondering if I'm at all like him Before the flood, before the flood of blood I'm dead serious, so just you wait The Manson Klan will look like saints (The Nazi Klan will look like saints) The plan's well underway, those who crossed me will see fewer days (The plan's well underway, those who crossed me are cursed) You're wastable to me; you're roadkill in the street (Just you wait, you will see fewer days) You're so wastable to me, like the roadkill in the street; you made a big mistake (Satan) So just you fucking wait (Satan) Blood on the walls; blood on the walls (Satan; Satan) Dear friends, goodbye, needlessly you fuck with me; now you're gonna die Blood on the walls; blood on the walls; blood on the walls; blood on the walls; blood on the walls; blood on the walls; blood on the walls; blood on the walls; blood on the walls; blood on the walls (Satan; Satan; Satan; Satan)",sebadoh,
"Drop your guard, I'll get to know you Simon says it's time to move And God only knows I think about you Cuz its never time to show and prove It's never time to show and prove Hiding all the time destroys me Never know what's right to do I only needed to feel a balance I just want to do right by you Sitting safe beside the truth Beside you Watch out for my bullshit Everybody's got it Careful as a soldier we're so strong Begging my new teacher Thought you'd never reach her She's standing there in front of you It's twice as hard to fool us It's twice as hard to fool us Careful as a soldier we're so strong Careful as a soldier we're so strong",sebadoh,
"It's all a matter of soul and fire Infatuation or true desire The thrill of discovery, divine intervention Cruel, cruel change, pain of rejection As you walk away, think of all the joy we shared If you decide you need me, I'll be wondering if I care Not there to soothe your soul, friend to tender friend I think our love is coming to an end King persuader, congratulations Share her heart, you bought her soul Princess confusion, come to me again Saying goodbye was so much fun When you walk away, feel the freedom in your heart There's a joy in letting go, free to find a love apart When I lose control, I need a kind, forgiving friend But I think our love is coming to an end I know our love is coming to an end",sebadoh,
"In my dreams I react as my true self And I learn humility Twisted moral planes As real as circumstance, each night I dance with primal urges Pornographic scenes That always start as they are ending In my dreams I walk with my true friends We discover secrets; we run through our lives Everything is twisted like abyss To the past and distant future I'm prepared for some big show Tried to arrive but I moved too slow Something's wrong when someone died Then I opened up my eyes Something's wrong when someone died Then I opened up my eyes",sebadoh,
