lyrics,artist,
"Little man, you are too impatient to understand This hateful world It's twisting you right through another girl Please slow down Let's help to find the secret of yourself Please believe you owe it to yourself to worship me I know a mystery or two A natural order always leaves a place for you I choose to gather strength from most what I see I live to give to you, but you don't give enough to me Remember this:  I possess a subtle holy gift I'm always here; never changing, scared, and half-sincere I'm obsessed to share with you the noise that I love best Let me in, then we'll sing together just like friends Doooo do do do do doooooo",sebadoh,
"Close my eyes Feel the fire Overwhelming fear and desire (so hard for you to stem the tide) Wavering heart, the flames growing higher (grab your bottle get your coat and hide) Lose what I have To test new water My mind is awash 'round the thoughts of her (so hard for you to fill my eyes) So much at stake, can't stay awake (temptation for me and for you) Drifting off (out with the tide) Dreams come so easily Filled with wasted fantasy We're together until the tide (so hard for you to stem the tide) Time enough to quell the day (test the water, there's the place, fill your heart) Tide's going out, here I am to stay (temptation tide)",sebadoh,
"Spoiled children soon to fall Freedom is the lie we live We will wait for tragedy And scatter helpless to the fire Sorry for ourselves Sorry for the things we've seen No one cries for help Waiting for the fire When all our toys are burning All these empty urges must be satisfied Acted outside Precious strength to turn the game to history Giving up, I'm blown away He said all I had to say The final days have come and gone Safe inside; there's nothing wrong Nothing in these words Sorry force of habit Could it be way over my head? Helpless to describe it Could it be way over my head? Helpless to describe it Could it be way over my head? Helpless to describe it Dumb & cruel Cut before it's grown Lies so forced in bored control It learned all that it cares to know",sebadoh,
"In blase and dream away Nothin' grew, so mark it bland (?) I'm sad, fuck sad, I'm teary-eyed Want a lovey-dovey honey, that's what I like I'm the finest drifter you'll ever meet I'm the kindest drifter you'll ever meet Don't think nothin' cards condemn I'm sure we both cut and shuffle them I cry cuz I'm drunk, plead cuz I'm down Gravity immune, yeah, I didn't leave town Learn to talk, teach me alchemy Now the witch can't spell what my future might be Want a lovey-dovey honey that will learn to talk I bought the gin and tonic, if you care to walk Carry on I will, my soul melting down Rotten beans, stumbling, now it's nothing but the town I'm the finest drifter you'll ever hate But I'll cook for you and I'll clean my plate",sebadoh,
"Can't think twice about the way I feel No one on Earth can stop the wheel There's an awful sound when you push me down Pin my shoulders to the ground You're so insane to close the door on me When you know everyone is going to see Things are all strewn about, can't figure out Wanna tear me apart, make a new start But you sneak on in to kick me in the shin",sebadoh,
"My soul mate is a special girl A girl that's just like me She'll share tremendous oral sex And try everything she sees She won't be insane or hung-up Like most other girls I'll worship her until it hurts Cuz she's on top of my world Ewwwww, I'm a sad man I can't ignore what life beholds for me And I'll probably have to have sex with a lot of girls Before my soul mate reveals herself to me You are sweet diversion as I stomp my darker way Don't let your heart get out of hand I'll step on it someday Maybe it's too sad to mention Maybe I am gay A moment or two may shine and sure to quickly fade away Ewwwww, it's a sad life Sometimes little sweet girls get left behind But baby, baby, baby it's a man's life And I gotta tear up everything I find",sebadoh,
"If you just wanna smoke a bowl of the finest homegrown No matter where you're coming from You can find my man there on the street You can find a man that'll peddle and you meet Weed makes you feel happy when you're feeling down Oh, yeah Weed even makes you smile when there's no one around Oh, yeah It's the weed that makes you sing when you're... Half-asleep, you can sing... Bored and nothing to do We sit In a Beat up old Chevy He'll tell ya; he'll tell He'll tell ya Yeah, he'll tell ya Yeah, I guess he'll tell ya No problem",sebadoh,
"If I'd had any sense, would it come to grips? If I go on home, would I have stayed around so long? Sooooo... I don't know, I don't know Pressing it to your lips, threaten me with your fist We're swimming out to sea, I think I know how it will be Oh, what I wanted; all I can have Oh, what you wanted; all you can have So you keep the change; you stay the same And no one can tell",sebadoh,
"No, I mean it, I'm really sorry; here I'll say it again I want you to know it, but the more I say it The less it means in the end Working for respect's like climbing a mountain And I think I'm losing my grip Once I'm fallin' and I think I'm fallin' There's no gettin' back on pace But my face makes that sorry shape I know who I am, but I lost my grace I'm gettin' a stick and I march for more Now I was wrong, everybody knows My mouth is moving but nothing's changing I just can't leave it alone Nervous defense that's doubled to senseless Milked it dry like a bone I milked it dry like a bone I just can't leave it alone I milked it dry like a bone I just can't leave it alone But my face makes that sorry shape I know who I am, but I lost my grace I'm gettin' a stick and I march for more Now I was wrong, everybody knows Everybody knows No, I mean it, I'm really sorry; here I'll say it again I want you to know it that the more I say it",sebadoh,
"Many mistakes will wait to be made Has one more ruined its life today? Torn down wide by the slightest suggestion Never believe in the perfect protection There's no peace anywhere, it's decided I don't know what I'm gonna do Never find peace in anything I can say One more ruined its life today Insisting on, depending on impossible confusion The last attack on this delicate illusion And I don't know what I'm gonna do",sebadoh,
"There is history in this place There are dragons to be chased And though I don't know who you are An easy flow and a strong, a strong heart And the charm in the way you hide Gently take my skull for a ride And I don't know who you are But I know what I would like you to be A one-night stand under stoned persuasion But a joy that I can't hide Gently take my skull for a ride We can never ever go too far The pain we can't escape at least will wait So let's go quickly, no we go slow Let's go chasing dragons through the snow Kindly take my all And give me all you have Gently take my skull for a ride Take and shake your soul But never lose control Gently take your skull for a ride",sebadoh,
"Damned if I do, and damned if I don't I told you I loved you, I wish that I hadn't You don't seem the same I guess I know you too well I knew I was falling, but I didn't know how low I'd fell Sister, oh sister, who told you these lies? I haven't got time to teach you what it could be like To pull you from this, child You don't smell the stink, but your mind has found the bed You think I'm all yours and I wish that I were dead The words were not your own, it was something your mother said Umbilical bloodline, mind control, by the whiny chat (?) Sister, oh sister, I thought it'd be nice That thing I felt when we first met just will not suffice The glimmer in your eyes I love you, sister A bloodline to condescend I thought so, sister, but I cannot pretend It's hard to believe this blood, this isn't healthy love It's hard to believe this love, this isn't healthy blood Sister, oh sister, you thought you were so wise But we're still fishing and coming from the blindest eye A logic you defy",sebadoh,
"Sweep the dirt under your rug You're on your drug, and then it hits me It's paregoric in my head, I'm all doped-up And just a baby Doing just fine, you're making up your mind...16 I'm all grown up and what I know It isn't from your mouth And now I'm confused cuz you don't talk Or wonder what I think I'm standing here and still I cannot hear you My passion's locked inside me Divulging your imperative For during, though, it's easy (?) A hundred years of therapy Thanks, thanks anyway, I'll soon be leaving",sebadoh,
"Trailing on next to sick Only broken magic sticks Evil pins never snare Figured out how to get nowhere Flying lead-filled flapping gills Phantom God in frozen time Comfort crawls into flight Wait for men grown, thunder dyin' Free toes roost on dancing wire Puzzling out a selfish high Commandment of meadow mouse Kiss the ground, lift up the house Wrapped in blankets of the mother's skin Perpetuate a freedom But there's nowhere to begin Bind one sky, ground to soil No one could care how your blood is boiling Grab a rubber needle, try to stick someone Needle is inverted to a rotten heart Simple, plain and simple Stars for eyes He's eager and overripe His tongue gets tied Weakened by a mighty blow Scars, four eyes A limping ""fell to stupid man"" Whose tongue is tied",sebadoh,
When there's someone doubting everything you do It keeps you alive unless someone's shaking their head at everything you do It keeps you true Never learned to feel I must take it out on you I am so open-minded Everyone should be united Everyone should fight for tell the truth Truth could never hurt the true Don't be as weak to try to figure it out It's not his problem, deny it as you churn inside Truest love he'll ever find No one could stand such a blatant invitation A stinking display of your sexual confusion You could never respect someone who Never knew he'd not resist No one could stand such a blatant invitation A stinking display of your sexual confusion You could never respect someone who Never knew he'd not resist,sebadoh
"I like saying yes and watching you take I don't need to sleep or eat, I smoke a thousand cigarettes These days are so nurturing When you're gone I'll eat and sleep away My days again Crazy people are right on, crazy people are right Crazy people are right on You're shit soup And I'm in the reflection booth Two glass eyes behind Cheap sunglasses move Stained-glass gazebo I really don't know Our futures are so separate Bespectacled and desperate It's not my job to undo The dying prophecy of you It's not my job to undo I like saying yes and watching you take I don't need to sleep or eat, I smoke a thousand cigarettes These days are so nurturing When you're gone I'll eat and sleep away My days again Crazy people are right on, crazy people are right Crazy people are right on They're so off they're on They're so off they're on They're so off they're on They're so off they're on They're so off they're on They're so off they're on They're so off they're on They're so off",sebadoh,
"Post-hardcore, pre-apocalyptic, science-fiction, drone-loving Renaissance Man Oh, what is true? What is real? No bullshit, brother Pot-smokin' Renaissance Man Wasted effort to stand up Real things happen when you're down Soulcore worship, whirling sound Brother, make a list, pierce your dick Future tribal-thought & rebel, greedy Renaissance Man Backbeat bloody conviction Power-sludge storm suckin' down Violence is cool, one of two things real Violence is free for all; live for revenge, ideal Don't wimp out; kill the pig There is no doubt; kill the pig Post-hardcore, hardass, intellectual Drone-loving Renaissance Man",sebadoh,
"With my head so low, the way I think could scrape the ground I will give them all control, I will crumble all around There's no need to say a word as logic burns right trough my head I could almost laugh out loud, the way this silence leaves me dead Feel afraid to speak, and I feel afraid to smile As I crave sacred attention, you could hit me all the while And you might be the weaker one, and I may stand and stare But I'll always know my place to keep this order safe, not sane",sebadoh,
"You make your words so nice I'm waiting you to name a price One will walk along Praying as you sing your song Way and winters upon the season You baby to me so right, would it be out of reason? You're me and my mouth; you know to my size of treason (?) The breezes went in their way to May Ride the darker wave Hello tomorrow today Ride the darker wave Hello tomorrow today",sebadoh,
"We're not here to crawl away Or find blame for wasted time Straight or high is not wasted time Feeling true in poor Paranoiaville Excuses are so easy When any jerk could push you down We got reason to learn how Trust any reason to rise now Turn your weakness on itself (?) Not right for you It's all right with me to fight with my friends When faith is near impossible And trust just isn't practical It's all right with me to feed on my friends You know what, he's got nothing to say They just wanna be rich and say, ""Fuck those groups who get the 4 star"" (?) Nothing could be betterA rockstar Blood-stained avant-garde popstar Peace doesn't underpush; exploit science, spacejam rockstar Rockstar Rockstar Rockstar Trust any reason to rise now Don't let the simple truth bring you down Money brings freedom, brings a new day Trust any reason; get rich, crawl away Faith is near impossible Trust just isn't practical It's not right for me to feed on my friends",sebadoh,
"Heart-broken and attractive A sad, sloppy mess Lookin' for approval And easily impressed Beware they say, but why would I listen? I need to know what I've been missing I'm no one you can trust All little-boy lonely with curious lust Confusion turns me upside down Lost as quickly as I'm found But soon enough it turns around On the rebound Call it fate or true love, never forced romance Fell into a new love Maybe perfect love by chance Beware they say, but why would I listen When it feels this good? No one lives their life Doing all the things they say they should Confusion turns me upside down Lost as quickly as I'm found But soon enough it turns around On the rebound (X4)",sebadoh,
Well I'm acting like a guy who just knows Cuz I'm lookin' for a punch in the nose I'm just lookin' for a punch in the nose You can be my best friend Or at least you can pretend I'm not lookin' for a punch in the nose If I say everything stinks It's 'cuz I'm bobbling for my own link Pray not lookin' for a punch in the nose (?) I'm not lookin' for a punch in the nose,sebadoh,
"Don't wanna show you a smile I wanna shut up til I die I cherish all that's pure So I lock my sound inside Don't hold these sweaty hands To view nothing fit Please realize that I've got nothing Cept the one, it's you that's it You can see the way I run It's no secret where I hide Masturbating Jesus creep, I jerk off til I die You should pound my skinny head To bleed me dry and true Then we'd sing together cuz there's nothing else to do Then we'd sing together cuz there's nothing else to do",sebadoh,
"Ankle-deep in your personal concerns Love it or leave it, it's all the same Find that perfect way to keep you happy Change the past if you can find it Get someone to help you out Find that perfect way to keep you angry The point that's pointed dull The edge that doesn't cut anymore Halfway up that wall But there's another right around the corner Drive a wedge, put your weight behind it Get someone to help you out Find that perfect way to keep you busy The point that's pointed dull The edge that doesn't cut anymore Halfway up that wall But there's another right around the corner You've got anger in your eyes, I don't buy it And if you're holdin' I'll shake you down Share that perfect way to keep me happy Share that perfect way to keep me happy",sebadoh,
"My opinion could change today, but I'm responsible anyway For second or third hand information That complicates the complication And I don't think before I speak And I don't know how far my words reach So wrong nearly every time, that I'm sorry I speak my mind If what I said was unkind Now it feels like I'm on fire It's burning the world through But don't hold it against me, cuz I know you're lying, too Is there any need for apology? There's no reason to believe me Judgments born in my jealous mind, creeping inside outside Connections I've made never follow through And sooner or later disappoint you Or cross you twice when your back is turned, that's how I've learned That someone has got to be burned Now it feels like I'm on fire, these words are not the truth But don't hold it against me, cuz I know you're lying, too Feels like I'm on fire, it's burning the world through Don't let me fall without someone to hold on to Someone to hold to, someone to hold on to",sebadoh,
So you think you're in the middle of the ocean Stranded on an island of your own Or stuck in the top of a mountain Either way you're gonna say you're all alone And I hesitate to say that you're a liar I never tell the truth myself But I tried to chase you down and I got tired So I'm leaving you to you or someone else Cuz you never wanna hook up in the middle And I'd meet you there to talk if you would show But you answer every question with a riddle And refuse to even choose to let me go It used to be I'd tell you all my secrets Giving you the credit you deserve I guess you didn't care to lose or keep it And we never quite connected from the first And I wish I had a way to make it better To rearrange the world and make you smile But it's dumb to even think I had that power And we haven't been that close in a while And I don't even wanna try to name it Explain it for the one who couldn't care Cuz all that matters is the way you choose to frame it And I hesitate to say that you're a liar I never tell the truth myself But I tried to chase you down and I got tired So I'm leaving you to you or someone else Cuz you never wanna hook up in the middle And I'd meet you there to talk if you would show But you answer every question with a riddle And refuse to even choose to let me go,sebadoh,
"It's no drama or a hurting kind of love that never gives I've got a sister with an open mind And the sweetest urge Whisper, fight it; a bed for me (?) Warmth rising to share with me Not damaged; a restless love or just wasting time? The wait has been satisfied I'm not jerkin' to lose my mind again I'm not smart enough to fake it No fool could fake a feeling this good C'mon girl, let's walk through this perverted world A few times; it's too insane A ""no-trust monster"" stomping in my brain Broken solid; solid shattered Forgot it forever and ever and ever... Slow down to a loving pace To the place I'd rather be A special sister love inside of me (could be killed?)",sebadoh,
"You can walk on fire You can talk to the dead You can wait til tomorrow You can't lose Ain't it nice to find some wasted time wasn't wasted blind? You only need to believe it Don't you worry, right away under You possess the perfect power All above, others under Hopeless, selfish, stupid power Superstar, super just like me Beauty is just a state of mind It don't matter how I waste my time Truth's just changin' every day today I think I like it that way I think I like it this way Almost weak enough to get me off No one's strong enough to make me stop No one's strong enough to make me stop",sebadoh,
"Here's an open-ended threat, subject to interpretation But I don't wanna fight just yet, I wanted to see what would happen And maybe I don't know my place, still thinking like a child Only trying to shake this shadow, squinting through a broken window Know who deserves it, who got there first Who lied about it and made things worse See, it don't matter I've only begun to confuse you It's what I do Here's an open-ended threat to tip the balance we've been riding With all this talk of honesty, I look and see who's really hiding Know who deserves it, who got there first Who lied about it and made things worse See, it don't matter I've only begun to confuse you It's what I do You deserve it, you got there first I didn't make it and that's still hurts I could be floating or ready to explode If I don't show, no one knows",sebadoh,
"If I'm right, sometimes I forget I might Shallow as the brook out back Bedtime stories that you can't take back Figure how to be a friend to you God knows I want to There's a lot of girls in the world That are nothing like you There's no need to condescend Not knowing, careful to pretend Give away your fucked-up friends Tired news and damaged trends Figure how to be a friend to you God knows I want to There's a lot of girls in the world That are nothing like you If we play your games, won't have time to play my games Forget how to be myself, but now I've got it figured out They're nothing like you (X4)",sebadoh,
"What was that you just said? That didn't make any sense to me It's not the way I see it, man I'm almost tired of listening to you Why do you tie me up with words? The way your eye shifts makes me wanna go Black-jawed living room couch professor When will you be through with me? I'd like to know Everywhere I go I feel it But I won't talk, I won't get stuck with you Everyone's so lonely I dig it But I'm afraid I can't share this with you So don't make me your captive I don't feel like talking your shit I nod my broken head I'm not too amused with humans",sebadoh,
"I'm not a good friend, I'm not a friend at all It's never resolved, I'm nervous when you call My words are limp, and my mind is dry I try to be polite, but I feel like I'm stuck for life I follow my heart, it leads me far from you No matter how close we are, I'm far, far away I have too much now to fill my day today I'm not a good friend, I'm not a friend at all I don't need obligations to our crippled conversations I'd never tell you, it's something you should know I'm not a friend at all, oh, please let me go Somehow I don't trust you I don't trust myself And I may never forgive you Cuz I can't forgive myself Somehow I don't trust you I don't trust myself And I may never forgive you Cuz I can't forgive myself Don't break my stride Don't break my stride Don't break my stride Don't break my stride",sebadoh,
"There is no soul; it's an everlasting tease In scared control; patterned easy, pleasing Why try to understand? It's never meant to be understood Logic is the bottomless pit A no-cure find; questions behind Take what you can Cut out the heart Who could ever blame you, man? Nothing's fair, we're all doomed from the start No different for us No different for us We're just like the others, no different for us Can't stop the change; the change can't stop Though we leave our souls for a hopeful trust It's different for us It's different for us We will survive the change It's different for us It's not cool to fall in love Scared and desperate in this life Safer, cool to judge outside Oh, to be complaining cool Never cool, though too excitable All that we will ever be They don't have to feel the pain we feel Pass their judgment, be sure, decide what's real I don't have to cry to make this real",sebadoh,
"There's a lie we've been living through Think you're all alone, it's not quite true No one cares, cuz no one should Everything you see was meant to be misunderstood Safe & sound, so safe & sound Move your body back and forth and round & round And all my friends are killing me, all my friends are killing me All my friends are killing me; I think I'm a genius",sebadoh,
"I guess when you met me, it was OK Cuz you made an exception for a thousand ways I'm sorry baby, yes, I was unkind I'm beginning to forget you're a friend of mine Destroying us in destroyer world We don't need to know what you're worth Compare yourself to nothing and no one You know it because you started out [Repeat] You started out It was the nick of time, girl, you got it all right (X3)",sebadoh,
"Lookin' at a new routine is the way to be Ain't no way out and the wheels are lazy Give a livin' when you're that again Hoard in sunshine, medicine Fell apart as humans will, they walked away from everything Carry a lantern, cuz I may live away Where I can relax when I leave this place Defined by age, I'm a monkey in rage Store it in rhythm cuz they cover more space (?) The Garden of Eden is a garbage dump Wild with daisies, I'm a hardcore punk Gridlock, jury, dismarry, dustbowl, dustcat deserving, gridlock, working...",sebadoh,
"Earnest little lover, little mystery man Nothing thrills you like denial There's nothing wrong with the need to please And children know no shame Baby on your bended knees and she'd love to play your game She's a curious girl easily swayed by your force of will Empty to be filled with the hunger for more What if time denies you, the key to your fulfillment fails? Around the world again on a boat that sinks as it sails Stand shoulders above her Pick her up when you love her Rub it right when you use her Need it so bad you abuse her But don't leave her alone cuz soon she'll be tasting The sweet unknown If it feeds her candy she'll follow it home Make your claim, she's legally yours When she shares your name But don't lose control cuz you'll scare her away Go on beg her to stay",sebadoh,
"I feel disconnected like I don't know where I am Things will be OK they say, but they don't understand The wait of every word that must mean everything Don't mean anything, put me down again I think and think til I feel fried and hope it goes away They don't listen unless it's special secrets first to say No one knows, no one cares and no one knows the way Unless of course you fall in love and everything is gray Everything is gray I want something, something very true Something worth my while, something special to do Every word, people push  for love People push and shove, people far above You are my dream love Peoples' narrow stories killing love",sebadoh,
