lyrics,artist
"I've been cryin' (for you) cuz I'm lonely tmiles have all turned to tears tears won't wash away the fearThat you're never ever gonna return to ease that fire that within me burns it keeps me cryin' baby for you keeps me sighing baby for you (for you) won't you hurry come one and see about me (come see about me) see about your baby (come see about me)I've given up my French dress (for you) your friends are talkin you have too no more piece of my pie until you come back and be mineNo matter what you do or say I'm gonna love you anyways it keeps me cryin' (baby, for you) I'm gonna keep sighin' (baby, for you) won't you hurry come one and see about me (come see about me) (come see about me) see about your babySometimes up sometimes down my life's so unsanctified with you not around from arms you maybe out of reach but my love says you're here to keep it keeps me cryin' (baby, for you) I'm gonna keep sighin' (baby, for you) won't you hurry come one and see about me (come see about me) see about your baby (come see about me) see about your baby hurry hurry hurry hurry",afghan whigs
"- Dulli - Whatever did happen to your soul? I heard you sold it To some old boy who lived uptown Who could afford it So what's gonna happen to you now? Therapy... The pharmacyCrazy That's what you'd like to believe But it ain't easy When yer goin' crazy Over the rainbow""I think your story's jive,"" she said There ain't nuthin' wrong with me If I use it to get me some sympathy Some ecstasy A memory... I wanna remember meCrazy about ya Crazy without ya Crazy Over you",afghan whigs
"(Dulli)Hear me now and don't forget I'm not the man my actions would suggest A little boy, I'm tied to you I fell apart That's what I always doThis ain't about regret My conscience can't be found This time I won't repent Somebody's going downFeel it now and don't resist This time the anger's better than the kiss I must admit when so inclined I tend to lose it than confront my mind'Cause it don't bleed and it don't breathe It's locked its jaws and now it's swallowing It's in our heart It's in our head It's in our love Baby it's in our bedTonight I go to hell For what I've done to you This ain't about regret It's when I tell the truthAnd once again the monster speaks Reveals his face and searches for release A little boy is tied to you Attracted only 'til it comes unglued",afghan whigs
"(Dulli)Love I can't hide But it's been easier Since I said it now Love It don't end And I can't buy A friendI waited long The waiting's over So get on down This time we go a little lower The sun has broke I stretch it out And throw some gas into the fire To tell the truth To tell it well It all depends upon the liar And if I scream, overboard I'm in this over my head Or whisper sweet Baby please, baby please Am I ded?Every time I dream about you, baby With your hands all over me I never forget anything Don't forget that I'm asleepGo to sleep It's over now A final prayer for my friend You tell that fool, to make it good You have to start at the end And if I scream, overkill I'm in this over my head Or whisper sweet, baby please I must have meant what I said",afghan whigs
"(Dulli)Tonight, tonight I say goodbye To everyone who loves me Stick it to my enemies, tonight Then I disappear Bathe my path in shining light Set the dials to thrill me Every secret has its price This one's set to killToo loose, too tight, too dark, too bright A lie, the truth, which one should I use? If the lie succeeds Then you'll know what I mean When I tell you I have secrets To attendDo you think I'm beautiful? Or do you think I'm evil? Will you take me for a ride? The one that never ends Too loose, too tight, too dark, too bright A lie, the truth, which one shall I use? If the lie succeeds Then you'll know what I mean When I tell you I have secrets To attendTonight, tonight I say goodbye To everything that thrills me As I throw the chains I forged in life To shatter on the floorAs I dream all the evidence Is piling up against me As I breathe all the essence rare Is falling off the vine And if you knew, just how smooth I could stop it on the dime You could meet me at the scene of the crime",afghan whigs
"the way people smile and say, using me in every way it's oktimes are changing life is upside down no reason to cry now oh no reason to cry nowbeware of who you listen to beware of what you believe ain't nothing i can do to you to make you love mefriends are the reason for so many breakups and breakdowns, round town so many people think that life is so much fun we've only just begun begun to have some funbeware of who you listen to beware of who you believe ain't nothing i cn do to you to make you love mebeware of who you listen to beware of what you believe ain't nothing i can do to you to make you love meto make you love me",afghan whigs
"- Dulli -Jean Content He wake up everyday In a government yard Deep down inside Citi Soleil Roll some bones and catch a fire Evil minds, they will conspire The moon to lose its light The stars sink into night Across the town A young girl plays guitar ""Do you remember me?"" She sings to a lover She worships from afar Roll some bones and catch a fire Evil minds, they will expire The moon to shine a light Upon us all tonightOoh child, I'll meet you, child On the sunny side, it's alright, it's alright No lies, and no cryin' It's alright""How you like me now?"" My friend, he say ""How you like the madness of Citi Soleil?"" Roll the bones and catch a fire Join the triumph of the choir Citi Soleil, Citi Soleil I love to say Citi Soleil",afghan whigs
"the way people smile and say, using me in every way it's oktimes are changing life is upside down no reason to cry now oh no reason to cry nowbeware of who you listen to beware of what you believe ain't nothing i can do to you to make you love mefriends are the reason for so many breakups and breakdowns, round town so many people think that life is so much fun we've only just begun begun to have some funbeware of who you listen to beware of who you believe ain't nothing i cn do to you to make you love mebeware of who you listen to beware of what you believe ain't nothing i can do to you to make you love meto make you love me",afghan whigs
"Are you back in my life to stay Or is it just for today oh that you need me If its a thrill you're lookin for well honey I am flexible oh yeahJust.... Be for real wont you baby Be for real wont you baby you see I, I dont want, to be hurt by love againYou can understand baby, can't you?Now you see I am not naive but I would like to believe oh what you tell me So don't give me the world today and then tomorrow take it away don't do that to me darlingNo.... Be for real wont you baby Be for real wont you baby You see I, I dont want, to be hurt by love againBe for real wont you baby Be for real wont you baby You see I, I dont want, to be hurt by love againBecause I, dont want, to be hurt by love again",afghan whigs
