lyrics,artist
,afghan whigs
"(Dulli)hey, baby there's a vampire moon scaling the sky shine in your room your eyes are open you got nothing to do come outside and play with me tonight follow me down to the bushes dear no one will know we'll disappear i'll hold your hand we'll never tell our private little trip to hell tonight can i walk you home tonight?",afghan whigs
"- Dulli -Hey... Welcome home I got a little wine Some Marvin Gaye Come on and taste me Come on and take me, I'm yours Dance, little sister, dance This is my girl you're talkin' to There isn't anything I wouldn't do So take me... Taste me... Erase me I'm yours... Let's get it onAnything for a lover Anything for a friend I only wanna see you happy Baby can we pretend I'd give anything to see you dance I'd give anything to see you smile But baby doesn't want just anything She wants everythingHey... Welcome home I got a little wine I got a little time So come on and take me Come on and taste me Come on and waste me Come on erase me I'm yours... Let's get it onI got the devil in me, girl",afghan whigs
"- Dulli/McCollum -I knew a girl, extraordinary Suggested something, unsanitary As I asked her for a moment To consider her kind offer She blew a kiss and said to me...I know you know You want it so I want it too, so see it through 'Cuz when I do what I'm gonna do to you Make sure you remember my nameYou know it's true I want it too I know you know, so make it so 'Cuz when I do what I'm gonna do to you You'll never ever, ever...Intoxicated, by your aggression I offer you my one possession You can fuck my body, baby But pleeze, don't fuck my mindGet you high, girl, come with me Take a ride in search of ecstasy I wanna roll with ya, I wanna roll I feel you now, I never knew You were so sad, i'll make it up to you 'Cuz I feel you now I feel you now...",afghan whigs
"(Arlen/Harberg)When a man's an empty kettle He should be on his mettle and yet I'm torn apart Just because I'm presumin' that I could be kind of human If I only had a heart I'd be tender, I'd be gentle and awful sentimental regarding love and art I'd be friends with the arrows and the boy who shoots the sparrows If I only had a heart Picture me a balcony Above a voice sings low ""Wherefore art thou Romeo?"" I hear a beat, how sweetJust to register emotion, jealousy, devotion and really feel the part I could stay young and chipper and I'd lock it with a zipper If I only had a heart A brain, a home, the nerve",afghan whigs
so what YOU make me hard if i was harder now i would crack into a million things things i didn't really need but how i wanted so what a nice dream didn't want to wake up so i kept it dark all the time dark enough so not to see but not as dark as the plans that YOU have for me so what YOU made me smile i had smiled at lesser things before i ever thought of YOU before i thought my soul was mine now i think about me only when i can find the time flowers all around put your lover in the ground flowers everywhere yeah yeah yeah nowhere YOU can be found i have put YOU in the ground nowhere is everywhere for YOU my flower better get myself a drink better get a couple so i can look YOU straight in the face tell YOU that i think of YOU almost as much as YOU think of YOU,afghan whigs
"(Dulli/McCollum)Ladies, let me tell you about myself I got a dick for a brain And my brain is gonna sell my ass to you Now I'm OK, but in time I'll find I'm stuck 'Cause she wants love, and I still want to fuck Now that I'm ashamed, it burns But the weight is off Now that you're out of the way I turn and I can walk You showed no sympathy, my love And this was no place for you and me to walk aloneOn my grave, am I OK? I'm sure I'm not Ladies let me tell you about my love She kept giving me more But it wasn't enough So understand Now that I come to you To understand my little self To understand my little selfAnd baby you be sweet",afghan whigs
honey yer junkie ass is fryin honey why don't YOU stop yer whinin yer barn door opens & YOU don't say black the sidewalk swallows don't YOU step up on the crack hhhhhhoney i know what worth was waiting for YOU got yer white coat mama YOU got yer heart of soul i see some crucifixion behind those two eyeholes gonna take yer white trash home better take yer white trash home i see yer hardon for the black girl keep yer bloody hands off me take me to your white trash party leave me swinging from a tree,afghan whigs
"- Dulli - Uptown again Nobody home Feelin' surrounded Should never left me on my own Remember nothing, hypnotize They say the eyes they never lie Your eyes have failed you dear, deny Deny, deny I know you'll tryBaby, untie me now I'm ready to get down Get down and move around Baby, you cry too much I'm tired of the sound Yer such a babyUptown again Throw me a bone Feelin' surrounded I've never done so well alone",afghan whigs
"(Dulli)My lust it ties me up In chains My skin catches fire at the Mention of your name No matter what I tried 2 do I could not lose itNow I know my heart Is being used But what I'm not allowed to have I never could refuse No matter what I tried 2 do I stood accusedI reply, that I don't believe I'm ever gonna die, I don't Do u?Blame, deny, betray, divide A lie, the truth Which one shall I use? Whatcha gonna do? I know Whatcha gonna do? I know, I know, I knowYour sanctimony Is showing my dear The acrimony Hangs in the air Beware of who u trust In this world Beware the lies about 2 unfurlI reply, that I don't believe I'm ever gonna die, I don't Do u? U were blind But u are not alone in this As I, was once Like u Blame, etc.",afghan whigs
how many girls would choose a cotton-dress world when they could have satins and lace? to stand by her man through good times and bad and still keep a smile on her face? how many hearts would feel the winter's wind blow and still not turn cold? true love travels on a gravel road love is a stranger and hearts are in danger on smooth streets paved with gold but true love travels on a gravel road down through the years we've had hard times and tears but it only helps our love grow and we'll stay together no matter how strong the wind blows not once have i seen your blue eyes fill with envy and stray from the one that you hold true love travels on a gravel road love is a stranger and hearts are in danger on smooth streets paved with gold but true love travels on a gravel road...,afghan whigs
"(Dulli/McCollum/Curley/Earle)untie the boat and turn on the water i'm gone, i'm gone, i'm gone it's alright untie the boat and turn on the water i'm gone, i'm gone, i'm gone it's alright carry me out deep into the ocean save me a prayer and let me over the side untie the boat and turn on the water i'm gone, i'm gone, i'm gone but it's alright and you can hold me down but don't you let me breathe let it wash all over me let it wash all over me they cut off my head, child and gave it away and poisoned the people i wanted to save and left me here dark and rolling around i'm gone, i'm gone, i'm gone but it's alright",afghan whigs
(Dulli)this is my confession angel let's not make too much about it this is my confession angel let's not make too much about it don't say a word don't do a thing lock yourself inside my dear this is what i mean i'm lying now i always do i know my way around the truth my need for guilt demands fresh fuel you've laid your trip upon me now won't you take me with you and it was all just meat to me you were only meat to me this is my confession angel let's not make too much about it this is my confession angel let's not make too much about it don't say a word don't do a thing don't you move a muscle worship silence as your king hide in the dark block out the light tricked into believing that the dog wouldn't bite and it was all just meat to me you were only meat to me,afghan whigs
"- Dulli -Baby Don't make me worry aboutcha You look so sad What'd ya do, to make ya so blue? I have to ask ya, where do you go? You look so faraway sometimes I don't know, where do you go? I wanna goMiles away and miles above The vampire only wants a little love You might be right, you might be Everything that you said that you were But, so?Baby Don't make me worry... Aboutcha They say that goodbye Arrives by design Who do you think about when you're lonely? I remember when you used to sing About your one and only You're such a phony Now I finally know you really know meMiles away and miles above The vampire only wants a little love A little love, a little more He's got ya now You're gone for sure",afghan whigs
(Dulli/McCollum)i walk around with this all over me i cannot wash it clean you've got the ball you've got the ball i'm taking it from you and today it's in the blood i left it in the blood you see so put the words together i'll be with you forever get up we'll rise they'll pay and wait until tomorrow night i can't recall yet if i'm black or if i'm white or wrong or if i'm white or wrong i am your creator come with me my congregation get up i'll smack you back down get up we'll rise they'll pay get up i'll smack you back down you will become my diamond i'm yours and you are mine get up we'll rise they'll pay,afghan whigs
one eye open baby both hands tied behind my back surprise acomin in a cross street smile how so the changes have come slow takers drivin got to take the wheel we got their lives ahanging & their souls to steal give me a break [give me an arm] wishbone cracky good luck charm rave on monkey come on down little sister what might be right for goose might not be right for the gander YOU got on the mississippi mudslide get up on the tchoupitoulis southpaw YOU got to lie now chillun you got to lie to be willin o my soul it's time to awake come on down give the kingdom a shake & o my soul it's time to get down,afghan whigs
"(Dulli)Did you feel the breeze? My love Summer's kiss is over, baby Over Do you know the words? Sing along with me And put on your rose fur coat, baby It's 1973My love, this dream I have each night I stare into a blinding light Alone, I stareDemons, be gone Away from me And come on down to the corner I got something i want you to see The burning sun Too hot for shade Come lay down in the cool grass With me, baby let's watch that Summer fadeMy love, this dream I have each night I stare into a blinding light Alone, I stare So sweet This dream is not a dream I wake with it Inside of me Alone, I swear",afghan whigs
"jane had a bottle of pills she kept beside her bed she took a couple when the sky came falling down ""what do you see in me"" she used to say out loud i see myself in a year if i'm still around & i don't feed the doll no no jane used to touch herself to make it go away the loneliness that would follow her all around & hold her pretty hand & wanna be her friend & hold the ceiling when the sky came falling down i don't really need you but since you're here tell me all about yourself my dear are YOU queer? what happened to your wrists do YOU need some help i can't be checking on YOU like this all the time YOU want some help then bleed somebody else YOU know YOU ain't gonna be mine",afghan whigs
television's gone and i'm alone with Lucifer what a drag muthafucker lied to you muthafucker took me head you're never alone with your jones and all you can't forget so roll on up the price is down so come on come on come on come on. today the retard speaks to me and now i have it all what a drag muthafucker lied to you it could never get that bad just ask so go on go on go on go on who you call retarded now? i said who you call retarded now? i see YOU standing proud come on down & swallow hard,afghan whigs
"(Dulli)if i stepped it off walked outside your trance crawled inside your mind and got my hands into your pants wouldn't that beat all wouldn't that be great and all the things you do to me we could exaggerate now everybody knows or everybody wants to know the hows, the whens, the whys of how i said goodbye don't forget the alcohol ooh baby ooh baby don't forget the alcohol ooh baby ooh baby don't forget the alcohol if i stepped it off walked outside your trance crawled inside your mind and got my hand into your pants don't forget the alcohol ooh baby ooh baby don't forget the alcohol",afghan whigs
"(Dulli)Whenever the light shines And the stillness is shaken And the drug of your smile has gone And left me alone I need it bad, I need it now Won't you come and give me some? I need it sweet, baby please Won't you answer the phone? Step into the light, baby Just give me the word And I will begin Step into the light, baby And see the trouble I'm in The light has gone My love has gone The good times have gone Away I have to ask, I need to know Was it ever love? I need it sweet, baby please Come and give me some",afghan whigs
"(Dulli)if i stepped it off walked outside your trance crawled inside your mind and got my hands into your pants wouldn't that beat all wouldn't that be great and all the things you do to me we could exaggerate now everybody knows or everybody wants to know the hows, the whens, the whys of how i said goodbye don't forget the alcohol ooh baby ooh baby don't forget the alcohol ooh baby ooh baby don't forget the alcohol if i stepped it off walked outside your trance crawled inside your mind and got my hand into your pants don't forget the alcohol ooh baby ooh baby don't forget the alcohol",afghan whigs
"- Dulli/McCollum - Up all night, again Az for sleep, no comprende I don't sleep 'cuz sleep iz the cousin of death Least that's what Nas say Sleep iz a state of mind And to know iz to be on your way I bought some bad drugs Off these snotty little rave kids I met And I shuffled off to Buffalo If I have love, then I hide it Then the people that I hide it from Have helped me to deny That it's not enough to show you care You gotta take on every double cross And every double dare, I swear to youUnchain your mind, become divine Surrender, surrender my love And get on down here and say it with me Yeah, yeah, yeahSick and tired again Fucked and wired again It's all so beautiful Sound like a stone temple sob story to me If I'm on your mind again You must be trippin' on some of that Voodoo I been throwin' down When you're high and lost in the clouds Then you know it's time to get down, again",afghan whigs
"- Dulli -I got your phone number, baby I'll call you sometime I think I might, be out tonight Maybe give you a ride Cocktails for two, down lover's lane I wantcha so bad, after tonight I'll never walk the same And you're to blameI wanna getcha high I wanna get next to you I wanna feel everything aboutcha, girl I wanna feel good You make me feel goodBaby, you don't know Just how I lie awake And dream awhile, about your smile And the way you make yo ass shake If that ain't love I guess I'll never know A sweeter lie, you'd be surprised Just how far I'd go To make it so",afghan whigs
"(Dulli)Repeat these words After me In all honesty Repeat these words After me If you dare to believe this YourselfAm I vain? Have I shame? Are my thoughts of a man Who can call himself sane? Do I blame, all my pain On the wickedness I have arranged? If I do, bring it downRepeat these words After me In all honesty Repeat these words After me If you dare to believe this YourselfAm I vain? Have I shame? Are my thoughts of a man Who can call himself sane? Is my fate, all the same As the man who has Walked the line straight If it is, bring it downAnd I, I must rely, my dear And I, cannot deny, my dear There will be a reckoning Which was, is And is to comeRepeat these words After me In all honesty Repeat these words After me If you dare To believe",afghan whigs
"Andrew Lloyd Webber--Music Tim Rice--Lyrics 1970 Leeds Music Ltd.Moneylenders and Merchants: Roll on up--for my price is down Come on in--for the best in town Take your pick of the finest wine Lay your bets on this bird of mine Roll on up--for the price is down Come on in--for the best in town Take your pick of the finest wine Lay your bets on this bird of mine Name your price I got everything Come and buy it's going fast Borrow cash on the finest terms Hurry now while stocks still lastJesus: My temple should be a house of prayer But you have made it a den of thieves Get Out! Get Out!Mine time is almost through Little left to do After all I've tried for 3 years, seems like 30, seems like 30...Crowd: See my eyes I can hardly see See me stand I can hardly walk I believe you can make me whole See my tongue I can hardly talk See my skin it's a mass of blood See my legs I can hardly stand I believe you can make me well See my purse I'm a poor poor man Will you touch will you mend me Christ Won't you touch will you heal me Christ Will you kiss you can cure me Christ Won't you kiss won't you pay me ChristJesus: There's too many of you--don't push me There's too little of me--don't crowd me, please don't crowd me (Scream) Heal Yourselves!",afghan whigs
"(Dulli)all alone, all alone no one to play with your eyes are all swollen from crying feeling sick you open it and discover your lover between the legs of another and he's loving it let me lie to you i'll be kind when i deceive you but you must never question me just quietly believe there, there you haven't a care i won't ever hurt you, deny or desert you don't ask me again wake up! and listen to thee someone must have told you someone must control you before you can get free",afghan whigs
(Dulli/McCollum)hypnotized by this endless summer filled with nothing i keep with me won't let them take this nothing from me won't let you waste my time for me i've been a good boy so give it to me and keep your brothers away from me they know i took it they're coming for me now i can hear them following we had talked about it for days it's not supposed to happen this way don't believe it's getting cold don't suppose i'm getting bold shove my head against the door crawl inside and kiss the floor waiting for the sun again drink it smoke it stick it in if i was going down taking everybody else around if i was going down,afghan whigs
television's gone and i'm alone with Lucifer what a drag muthafucker lied to you muthafucker took me head you're never alone with your jones and all you can't forget so roll on up the price is down so come on come on come on come on. today the retard speaks to me and now i have it all what a drag muthafucker lied to you it could never get that bad just ask so go on go on go on go on who you call retarded now? i said who you call retarded now? i see YOU standing proud come on down & swallow hard,afghan whigs
"(Penn/Moman)At the dark end of the street That's where we always meet Hiding in shadows where we don't belong Living in darkness to hide our wrong You and me at the dark end of the street You and meI know time is gonna take its toll We have to pay for what we stole It's a sin, and we know it's wrong But our love keeps coming on strong Steal away to the dark end of the streetAnd when the daylight hour rolls around If by chance we should walk downtown If we should meet, just walk on by Ooooh darling, please don't cry Tonight we'll meet at the dark end of the street You and meThey're gonna find us They're gonna find us They're gonna find us Oooooh, some day You and me at the dark end of the street You and me",afghan whigs
"(Dulli)I hear the whispers, baby If what they say is true They say I killed the brother To fall in love with uThese words I heard them once before A conversation I believe How does a man begin 2 fall When he does practice 2 deceive? There was a voice behind my back His face I could not see it clear The voice was so familiar, though I knew my enemy was nearThe sun iz gone And the sky iz black So get your ass out from Behind my back I told u once And I told u all And I told it like it was (sic)U can't Have me If u can't Catch me Out of your mind bent on revenge To think I once called u my friend U want the dog? I'll let him out Come and get some baby",afghan whigs
"(Dulli)You can believe in me, baby Can I believe in you? What you don't know Can hurt you, child All the things a mind can Do to youIf I go bad From time to time Love to love but love is not My only crime Bathe the path, shine the light Better get your ass up on The mountain, baby I'll take you up tonightFaded This I feel Behind the blue clouds I remain concealed Lord, lift me out of the night Come on, look down And see the mess I'm in tonightYou can believe in me, baby Can I believe in you? I wish I could remember what You said, when I said EnoughYou said Good boy... bad boy... killjoy... Get your ass over here, boy And since I know Myself so well Don't breathe a word Don't you ever tellYou can believe in me, baby Can I believe in you? That secret's gonna kill you In the end It's gonna kill You",afghan whigs
"(Dulli/McCollum)It was a Saturday I came home early drunk with love And other things I must confess I love it all Pretend that I can hardly wait To wipe that smile off of your face It's only when On that you can dependLater that afternoon My paranoia got the best of me I knew it would, it always do I made the call Pretend that I can hardly wait To put that smile back on my face It's coming soon I'm going to the moonIf you pretend, then I imitate My friend, come crucify my heart I wanna get it on I wanna get it onAnd in the evening when I sleep My situation changes nightly Sometimes it comes, sometimes it goes Sometimes I feel I'll never knowTonight's the night I take it home White knuckle happy and alone With no one in the room but me I see I finally see",afghan whigs
(Dulli)get off that stuff she said and i'll stone you instead unchain yourself said she and tie yourself to me i'm on the floor i play with knives you can call and ask your wife she's been over once or twice likes to use me and i'm her slave but i don't need no chains i'll behave give me more of what i've come to expect wrap your love around my neck understand me when i say you'll deny me,afghan whigs
"(Dulli)Lover mine Get your coat and come outside I wanna take you for a ride On into townLover fair We'll be looking sharp, I swear I want them all to stop and stare When we take 'em downGo to town, burn it down, turn around and get your stroll on, baby I'll get the car You get the match And gasolineAnd as we ride Away into the countryside I feel as though I must confide There is a cost When you say Now we got Hell to pay Don't worry, baby, that's okay I know the boss",afghan whigs
"(Dulli)Got u where I want u Motherfucker I got 5ive up on your dime And if u wanna peep on something Peep what I got stuck between Your eyes And since I don't believe A word u say Save it for another, baby brother Swallow time 2 payUp on the ladder they sing How high? Does a brother have to climb 2 touch the lightBut wait 'till I get done With u If u tell me ""Don't get mixed up with the Devil"" That's exactly What I'm gonna doCaught u while u waited For your boy 2 come And fix u up again Come a little closer, baby I only wanna try 2 Be your friend Since I ain't got nothing Left 2 lose Got u where I want u Motherfucker Don't u try 2 moveUp on the ladder they sing How high? Does a brother have 2 climb 2 touch the light Won't u take me up there With u? U said u would No one ever could shake That ladder like I couldSo I wait",afghan whigs
(Austin)The 22nd of loneliness and we've been through so many thangs I love my girl with all honesty But I know she's cheatin' on me I look her in the eyes but all she tells me are lies that keep me near I'll never leave her down though I might mess around it's only 'cause I need some affectionSo I creep yeah Just keep it on the down low Said nobody is supposed to know So I creep yeah 'Cause she doesn't know what I do and no attention goes to showThe 23rd of loneliness And we don't talk like we used to do Now it seems pretty strange but I'm not buggin' 'cause I still feel the same yeah yeah I'll keep giving loving Till the day she pushes me away Never go astray If she knew the things I did She couldn't handle it So I choose to keep her protectedSo I creep yeah Just keep it on the down low Said nobody is supposed to know So I creep yeah 'Cause she doesn't know what I do and no attention goes to showI creep around because I need attention Don't mess around with my affection I creep around because I need attention Don't mess around Oh I oh I oh I oh I baby Oh I oh I oh I oh I yeah Oh I oh I oh I oh I baby Oh I oh I oh I oh I yeah,afghan whigs
"(Dulli)my love don't comfort me she toys with my sincerity on that i can depend i've found that nothing's straight my twisted mind is bent all out of shape but you will come back and you will live on indeed i know but you wouldn't lie when i told you to had to waste your time and tell the truth this one is three, this is one is three indeed i know you got me figured out now now we're both disappointed what's done is now undone let's cut the line and have the action in time i will be able to give",afghan whigs
"(Dulli/McCollum/Curley/Earle)i smell your blood, my love but i can't taste it yet i have your mind, my love but i can't waste it yet please understand my love i find this sickening my head is ice my love my skin is thickening but oh! my love we could still be friends and oh! my love with me you must contend i'm gonna turn on you before you turn on me i'm gonna turn on you can you conjure me? and walk the mile into this web of my conspiracy i'm gonna turn on you before you turn on me i'm in a hole but i don't feel the safety net i have your soul but i am wasting it but oh! my love we could still be friends and oh! my love with me you must contend",afghan whigs
